{
 "schemaVersion": 1,
 "courseId": "algebra2",
 "unitId": "quadratic-functions-complex-numbers",
 "questions": [
  {
   "id": "a2-qc-s01-cp2-001",
   "skillId": "quadratic-functions-complex-numbers-skill-01",
   "level": "cp2",
   "format": "short-answer",
   "prompt": "For y = x² - 4x + 3, find the vertex and the axis of symmetry.",
   "answer": "vertex (2, -1); x = 2",
   "solutionSteps": [
    "x = -b/(2a) = 4/(2·1) = 2.",
    "y = -1 at that x.",
    "Axis of symmetry: x = 2."
   ],
   "standards": [
    "F-IF.C.7a"
   ],
   "sourceNotes": "Original Claude-authored item; answer computed and checked in authoring script. Awaiting human review."
  },
  {
   "id": "a2-qc-s01-cp2-002",
   "skillId": "quadratic-functions-complex-numbers-skill-01",
   "level": "cp2",
   "format": "short-answer",
   "prompt": "For y = -x² + 2x + 8, find the vertex and the axis of symmetry.",
   "answer": "vertex (1, 9); x = 1",
   "solutionSteps": [
    "x = -b/(2a) = -2/(2·-1) = 1.",
    "y = 9 at that x.",
    "Axis of symmetry: x = 1."
   ],
   "standards": [
    "F-IF.C.7a"
   ],
   "sourceNotes": "Original Claude-authored item; answer computed and checked in authoring script. Awaiting human review."
  },
  {
   "id": "a2-qc-s01-cp2-003",
   "skillId": "quadratic-functions-complex-numbers-skill-01",
   "level": "cp2",
   "format": "short-answer",
   "prompt": "For y = 2x² + 8x + 5, find the vertex and the axis of symmetry.",
   "answer": "vertex (-2, -3); x = -2",
   "solutionSteps": [
    "x = -b/(2a) = -8/(2·2) = -2.",
    "y = -3 at that x.",
    "Axis of symmetry: x = -2."
   ],
   "standards": [
    "F-IF.C.7a"
   ],
   "sourceNotes": "Original Claude-authored item; answer computed and checked in authoring script. Awaiting human review."
  },
  {
   "id": "a2-qc-s01-cp2-004",
   "skillId": "quadratic-functions-complex-numbers-skill-01",
   "level": "cp2",
   "format": "short-answer",
   "prompt": "For y = x² + 6x + 9, find the vertex and the axis of symmetry.",
   "answer": "vertex (-3, 0); x = -3",
   "solutionSteps": [
    "x = -b/(2a) = -6/(2·1) = -3.",
    "y = 0 at that x.",
    "Axis of symmetry: x = -3."
   ],
   "standards": [
    "F-IF.C.7a"
   ],
   "sourceNotes": "Original Claude-authored item; answer computed and checked in authoring script. Awaiting human review."
  },
  {
   "id": "a2-qc-s01-cp2-005",
   "skillId": "quadratic-functions-complex-numbers-skill-01",
   "level": "cp2",
   "format": "short-answer",
   "prompt": "For y = -2x² + 4x + 1, find the vertex and the axis of symmetry.",
   "answer": "vertex (1, 3); x = 1",
   "solutionSteps": [
    "x = -b/(2a) = -4/(2·-2) = 1.",
    "y = 3 at that x.",
    "Axis of symmetry: x = 1."
   ],
   "standards": [
    "F-IF.C.7a"
   ],
   "sourceNotes": "Original Claude-authored item; answer computed and checked in authoring script. Awaiting human review."
  },
  {
   "id": "a2-qc-s01-cp2-006",
   "skillId": "quadratic-functions-complex-numbers-skill-01",
   "level": "cp2",
   "format": "short-answer",
   "prompt": "For y = x²/2 - 2x - 1, find the vertex and the axis of symmetry.",
   "answer": "vertex (2, -3); x = 2",
   "solutionSteps": [
    "x = -b/(2a) = 2/(2·1/2) = 2.",
    "y = -3 at that x.",
    "Axis of symmetry: x = 2."
   ],
   "standards": [
    "F-IF.C.7a"
   ],
   "sourceNotes": "Original Claude-authored item; answer computed and checked in authoring script. Awaiting human review."
  },
  {
   "id": "a2-qc-s01-cp2-007",
   "skillId": "quadratic-functions-complex-numbers-skill-01",
   "level": "cp2",
   "format": "multiple-choice",
   "prompt": "Does y = x² - 2x - 3 have a maximum or a minimum, and what is it?",
   "answer": "Minimum of -4",
   "solutionSteps": [
    "a = 1 > 0: opens up → minimum.",
    "The extreme value is the vertex y-coordinate, -4; 1 is its x-coordinate."
   ],
   "options": [
    {
     "text": "Maximum of -4",
     "correct": false
    },
    {
     "text": "Minimum of 1",
     "correct": false
    },
    {
     "text": "Minimum of -3",
     "correct": false
    },
    {
     "text": "Minimum of -4",
     "correct": true
    }
   ],
   "standards": [
    "F-IF.C.7a"
   ],
   "sourceNotes": "Original Claude-authored item; answer computed and checked in authoring script. Awaiting human review."
  },
  {
   "id": "a2-qc-s01-cp2-008",
   "skillId": "quadratic-functions-complex-numbers-skill-01",
   "level": "cp2",
   "format": "multiple-choice",
   "prompt": "Does y = -x² + 4 have a maximum or a minimum, and what is it?",
   "answer": "Maximum of 4",
   "solutionSteps": [
    "a = -1 < 0: opens down → maximum.",
    "The extreme value is the vertex y-coordinate, 4; 0 is its x-coordinate."
   ],
   "options": [
    {
     "text": "Maximum of 0",
     "correct": false
    },
    {
     "text": "Minimum of 4",
     "correct": false
    },
    {
     "text": "Maximum of 4",
     "correct": true
    }
   ],
   "standards": [
    "F-IF.C.7a"
   ],
   "sourceNotes": "Original Claude-authored item; answer computed and checked in authoring script. Awaiting human review."
  },
  {
   "id": "a2-qc-s01-cp2-009",
   "skillId": "quadratic-functions-complex-numbers-skill-01",
   "level": "cp2",
   "format": "multiple-choice",
   "prompt": "Does y = 2x² - 4x have a maximum or a minimum, and what is it?",
   "answer": "Minimum of -2",
   "solutionSteps": [
    "a = 2 > 0: opens up → minimum.",
    "The extreme value is the vertex y-coordinate, -2; 1 is its x-coordinate."
   ],
   "options": [
    {
     "text": "Maximum of -2",
     "correct": false
    },
    {
     "text": "Minimum of 0",
     "correct": false
    },
    {
     "text": "Minimum of 1",
     "correct": false
    },
    {
     "text": "Minimum of -2",
     "correct": true
    }
   ],
   "standards": [
    "F-IF.C.7a"
   ],
   "sourceNotes": "Original Claude-authored item; answer computed and checked in authoring script. Awaiting human review."
  },
  {
   "id": "a2-qc-s01-cp1-001",
   "skillId": "quadratic-functions-complex-numbers-skill-01",
   "level": "cp1",
   "format": "multiple-choice",
   "prompt": "Which equation matches the graph?",
   "answer": "y = (x - 2)² - 4",
   "solutionSteps": [
    "Vertex (2, -4) gives y = a(x - h)² + k.",
    "Use an x-intercept to find a: a = 1."
   ],
   "options": [
    {
     "text": "y = (x + 2)² - 4",
     "correct": false
    },
    {
     "text": "y = (x - 2)² + 4",
     "correct": false
    },
    {
     "text": "y = -(x - 2)² - 4",
     "correct": false
    },
    {
     "text": "y = (x - 2)² - 4",
     "correct": true
    }
   ],
   "diagram": {
    "type": "image",
    "spec": {
     "src": "question-banks/assets/algebra2/quadratic-functions-complex-numbers/s01-parab-2--4.png",
     "alt": "A parabola with vertex (2, -4) opening up and crossing the x-axis at 0 and 4."
    }
   },
   "standards": [
    "F-IF.C.7a"
   ],
   "sourceNotes": "Original Claude-authored item; answer computed and checked in authoring script. Awaiting human review."
  },
  {
   "id": "a2-qc-s01-cp1-002",
   "skillId": "quadratic-functions-complex-numbers-skill-01",
   "level": "cp1",
   "format": "multiple-choice",
   "prompt": "Which equation matches the graph?",
   "answer": "y = -(x + 1)² + 4",
   "solutionSteps": [
    "Vertex (-1, 4) gives y = a(x - h)² + k.",
    "Use an x-intercept to find a: a = -1."
   ],
   "options": [
    {
     "text": "y = (x + 1)² + 4",
     "correct": false
    },
    {
     "text": "y = -(x - 1)² + 4",
     "correct": false
    },
    {
     "text": "y = -(x + 1)² - 4",
     "correct": false
    },
    {
     "text": "y = -(x + 1)² + 4",
     "correct": true
    }
   ],
   "diagram": {
    "type": "image",
    "spec": {
     "src": "question-banks/assets/algebra2/quadratic-functions-complex-numbers/s01-parab--1-4.png",
     "alt": "A parabola with vertex (-1, 4) opening down and crossing the x-axis at -3 and 1."
    }
   },
   "standards": [
    "F-IF.C.7a"
   ],
   "sourceNotes": "Original Claude-authored item; answer computed and checked in authoring script. Awaiting human review."
  },
  {
   "id": "a2-qc-s01-cp1-003",
   "skillId": "quadratic-functions-complex-numbers-skill-01",
   "level": "cp1",
   "format": "multiple-choice",
   "prompt": "Which equation matches the graph?",
   "answer": "y = x²/2 - 2",
   "solutionSteps": [
    "Vertex (0, -2) gives y = a(x - h)² + k.",
    "Use an x-intercept to find a: a = 1/2."
   ],
   "options": [
    {
     "text": "y = x²/2 + 2",
     "correct": false
    },
    {
     "text": "y = x²/2 - 2",
     "correct": true
    },
    {
     "text": "y = x² - 2",
     "correct": false
    },
    {
     "text": "y = -x²/2 - 2",
     "correct": false
    }
   ],
   "diagram": {
    "type": "image",
    "spec": {
     "src": "question-banks/assets/algebra2/quadratic-functions-complex-numbers/s01-parab-0--2.png",
     "alt": "A parabola with vertex (0, -2) opening up and crossing the x-axis at -2 and 2."
    }
   },
   "standards": [
    "F-IF.C.7a"
   ],
   "sourceNotes": "Original Claude-authored item; answer computed and checked in authoring script. Awaiting human review."
  },
  {
   "id": "a2-qc-s01-cp1-004",
   "skillId": "quadratic-functions-complex-numbers-skill-01",
   "level": "cp1",
   "format": "select-all",
   "prompt": "Select ALL true statements about y = -2x² + 8x - 6.",
   "answer": [
    "The graph opens down",
    "The vertex is (2, 2)",
    "The x-intercepts are 1 and 3",
    "The y-intercept is -6"
   ],
   "solutionSteps": [
    "a = -2 < 0.",
    "h = -8/(-4) = 2, k = -8 + 16 - 6 = 2.",
    "-2(x² - 4x + 3) = -2(x - 1)(x - 3).",
    "y(0) = -6.",
    "Axis is x = 2; 2 is a maximum."
   ],
   "options": [
    {
     "text": "The vertex is (2, 2)",
     "correct": true
    },
    {
     "text": "The x-intercepts are 1 and 3",
     "correct": true
    },
    {
     "text": "The minimum value is 2",
     "correct": false
    },
    {
     "text": "The axis of symmetry is x = -2",
     "correct": false
    },
    {
     "text": "The y-intercept is -6",